date;title;category;source;primary_topic;seo_keywords;quality_score;seo_score;url;status
"2026-02-23 07:01";"Alzheimer : une carence cérébrale inattendue pourrait être l’un des premiers déclencheurs";Santé;"Futura Sciences";;;;;https://www.futura-sciences.com/sante/actualites/maladie-alzheimer-alzheimer-carence-cerebrale-inattendue-pourrait-etre-premiers-declencheurs-w2t8-131389/#xtor%3DRSS-8;new
"2026-02-23 05:44";"Vaches absentes, loi Duplomb, guerre des prix… Cinq enjeux qui secouent l’édition 2026 du Salon de l’agriculture";Économie;Novethic;;;;;https://www.novethic.fr/environnement/biodiversite/vaches-absentes-loi-duplomb-guerre-prix-cinq-enjeux-secouent-salon-agriculture;new
"2026-02-22 20:03";"Patient bizarre : une femme découvre qu’elle produit du lait par la poitrine… et les aisselles !";Santé;"Futura Sciences";;;;;https://www.futura-sciences.com/sante/actualites/maladie-patient-bizarre-femme-decouvre-quelle-produit-lait-poitrine-aisselles-131421/#xtor%3DRSS-8;new
"2026-02-22 18:00";"Ils l’avaient annoncé il y a 40 ans… et les ouragans deviennent aujourd’hui plus dangereux que prévu";Sciences;"Futura Sciences";;;;;https://www.futura-sciences.com/planete/actualites/ouragan-ils-avaient-annonce-il-y-40-ans-ouragans-deviennent-aujourdhui-plus-dangereux-prevu-w2t8-131483/#xtor%3DRSS-8;failed
"2026-02-22 17:03";"Comment le cheval est passé de la boucherie au club d'équitation en moins de deux générations ?";Sciences;"Futura Sciences";;;;;https://www.futura-sciences.com/planete/actualites/animaux-cheval-passe-boucherie-club-equitation-moins-deux-generations-131322/#xtor%3DRSS-8;failed
"2026-02-22 15:02";"Le retour au travail après un bébé : la fracture silencieuse que 82 % des parents n'osent pas nommer";Santé;"Futura Sciences";;;;;https://www.futura-sciences.com/sante/actualites/travail-retour-travail-apres-bebe-fracture-silencieuse-82-parents-nosent-pas-nommer-131442/#xtor%3DRSS-8;new
"2026-02-22 14:03";"Paris en 2050 : le Louvre, la Tour Eiffel et les immeubles haussmanniens métamorphosés";Sciences;"Futura Sciences";;;;;https://www.futura-sciences.com/planete/actualites/ville-paris-2050-louvre-tour-eiffel-immeubles-haussmanniens-metamorphoses-128606/#xtor%3DRSS-8;failed
"2026-02-22 12:57";"Agriculture intensive contestée : les alternatives sont-elles comparables ?";Sciences;"Futura Sciences";;;;;https://www.futura-sciences.com/planete/actualites/agriculture-agriculture-intensive-contestee-alternatives-sont-elles-comparables-131511/#xtor%3DRSS-8;failed
"2026-02-22 12:03";"Dépression et anxiété : ces trois sports qui feraient aussi bien, voire mieux, que les traitements";Santé;"Futura Sciences";;;;;https://www.futura-sciences.com/sante/actualites/sport-depression-anxiete-ces-trois-sports-feraient-aussi-bien-voire-mieux-traitements-131525/#xtor%3DRSS-8;new
"2026-02-22 10:02";"Utiliser l'IA au quotidien ne suffit pas à repérer les images deepfakes : la science l'a désormais prouvé";Santé;"Futura Sciences";;;;;https://www.futura-sciences.com/sante/actualites/psychologie-utiliser-ia-quotidien-ne-suffit-pas-reperer-images-deepfakes-science-desormais-prouve-131497/#xtor%3DRSS-8;new
"2026-02-22 09:00";"Les scientifiques découvrent un « nouveau langage » du cerveau humain";Santé;"Futura Sciences";;;;;https://www.futura-sciences.com/sante/actualites/cerveau-scientifiques-decouvrent-nouveau-langage-cerveau-humain-k2m6-131316/#xtor%3DRSS-8;new
"2026-02-22 07:01";"Cette démence évitable est aujourd’hui la première cause de troubles cognitifs précoces en France";Santé;"Futura Sciences";;;;;https://www.futura-sciences.com/sante/actualites/demence-cette-demence-evitable-aujourdhui-premiere-cause-troubles-cognitifs-precoces-france-w2t8-131365/#xtor%3DRSS-8;new
"2026-02-21 20:03";"Patient bizarre : aveugle depuis l’âge de 11 ans, elle retrouve la vue en se cognant la tête contre une table !";Santé;"Futura Sciences";;;;;https://www.futura-sciences.com/sante/actualites/vue-patient-bizarre-aveugle-depuis-age-11-ans-elle-retrouve-vue-cognant-tete-table-131461/#xtor%3DRSS-8;new
"2026-02-21 19:51";"Accalmie trompeuse : le risque d’inondations pourrait repartir la semaine prochaine";Sciences;"Futura Sciences";;;;;https://www.futura-sciences.com/planete/actualites/meteorologie-accalmie-trompeuse-risque-inondations-pourrait-repartir-semaine-prochaine-131528/#xtor%3DRSS-8;failed
"2026-02-21 19:29";"Muscler cet organe favorise des orgasmes plus intenses chez la femme et chez l’homme";Santé;"Futura Sciences";;;;;https://www.futura-sciences.com/sante/actualites/sexualite-muscler-cet-organe-favorise-orgasmes-plus-intenses-chez-femme-chez-homme-131440/#xtor%3DRSS-8;new
"2026-02-21 19:00";"Point de non-retour : cette extinction qui a anéanti 90 % de la vie";Sciences;"Futura Sciences";;;;;https://www.futura-sciences.com/planete/actualites/rechauffement-climatique-point-non-retour-cette-extinction-aneanti-90-vie-w2t8-131474/#xtor%3DRSS-8;failed
"2026-02-21 18:00";"Avril 1970 : comment un enchaînement météo a provoqué l’un des pires drames humains en France";Sciences;"Futura Sciences";;;;;https://www.futura-sciences.com/planete/actualites/meteorologie-avril-1970-enchainement-meteo-provoque-pires-drames-naturels-france-w2t8-131458/#xtor%3DRSS-8;failed
"2026-02-21 17:02";"Il ressemble à un chaton mais aboie comme un chien : voici le chat des sables";Sciences;"Futura Sciences";;;;;https://www.futura-sciences.com/planete/actualites/chat-decouvrez-chat-sables-felin-unique-monde-minuscule-invisible-aboie-131450/#xtor%3DRSS-8;failed
"2026-02-21 14:57";"Phénomène météo extraordinaire : 7 soleils et 4 lunes, non vous ne rêvez pas !";Sciences;"Futura Sciences";;;;;https://www.futura-sciences.com/planete/actualites/meteorologie-phenomene-meteo-extraordinaire-7-soleils-4-lunes-non-vous-ne-revez-pas-131493/#xtor%3DRSS-8;failed
"2026-02-21 10:00";"Ces 5 habitudes transforment la relation avec vos enfants… même quand ils quittent la maison";Santé;"Futura Sciences";;;;;https://www.futura-sciences.com/sante/actualites/adolescent-ces-5-habitudes-transforment-relation-vos-enfants-meme-ils-quittent-maison-k2m6-131236/#xtor%3DRSS-8;new
"2026-02-21 09:00";"Inondations : la solution la plus efficace existe… mais la France tarde encore à l’appliquer";Sciences;"Futura Sciences";;;;;https://www.futura-sciences.com/planete/actualites/rechauffement-climatique-inondations-solution-plus-efficace-existe-mais-france-tarde-encore-appliquer-k2m6-131314/#xtor%3DRSS-8;failed
"2026-02-21 07:01";"Et si la démence n’était pas une fatalité ? Les 14 facteurs sur lesquels vous pouvez agir";Santé;"Futura Sciences";;;;;https://www.futura-sciences.com/sante/actualites/demence-si-demence-netait-pas-fatalite-14-facteurs-lesquels-vous-pouvez-agir-w2t8-131350/#xtor%3DRSS-8;new
"2026-02-20 19:27";"Vigilance rouge : une semaine où tout a basculé dans le Lot-et-Garonne (récit)";Sciences;"Futura Sciences";;;;;https://www.futura-sciences.com/planete/actualites/tempete-nils-vigilance-rouge-semaine-tout-bascule-lot-garonne-recit-131538/#xtor%3DRSS-8;failed
"2026-02-20 18:21";"Découvert au cœur du désert, ce Spinosaurus remet en cause l’idée du nageur redoutable";Sciences;"Futura Sciences";;;;;https://www.futura-sciences.com/planete/actualites/dinosaure-decouvert-coeur-desert-ce-spinosaurus-remet-cause-idee-nageur-redoutable-131516/#xtor%3DRSS-8;failed
"2026-02-20 18:00";"Une tornade emporte un bébé… et le dépose vivant à un endroit totalement inattendu";Sciences;"Futura Sciences";;;;;https://www.futura-sciences.com/planete/actualites/meteorologie-tornade-emporte-bebe-depose-vivant-endroit-totalement-inattendu-w2t8-131192/#xtor%3DRSS-8;failed
"2026-02-20 17:41";"Procès TotalEnergies et climat : les juges décideront-ils d’entrer dans l’Histoire ?";Économie;Novethic;;;;;https://www.novethic.fr/environnement/climat/proces-totalenergies-et-climat-les-juges-decideront-ils-dentrer-dans-lhistoire;new
"2026-02-20 17:35";"Le jour où les cactus du désert ont été ensevelis sous la neige";Sciences;"Futura Sciences";;;;;https://www.futura-sciences.com/planete/actualites/meteorologie-jour-cactus-desert-ont-ete-ensevelis-sous-neige-131494/#xtor%3DRSS-8;failed
"2026-02-20 16:39";"Plus de la moitié du territoire français est exposé au risque de retrait-gonflement des argiles";Sciences;"Futura Sciences";;;;;https://www.futura-sciences.com/planete/actualites/geologie-plus-moitie-territoire-francais-expose-risque-retrait-gonflement-argiles-131518/#xtor%3DRSS-8;failed
"2026-02-20 14:43";"Les scientifiques s’inquiètent : l’Antarctique entre dans une zone à risque qui pourrait tout accélérer";Sciences;"Futura Sciences";;;;;https://www.futura-sciences.com/planete/actualites/antarctique-scientifiques-inquietent-antarctique-zone-risque-pourrait-tout-accelerer-131469/#xtor%3DRSS-8;failed
"2026-02-20 12:28";"Stress, anxiété : êtes-vous dans le groupe qui encaisse… ou celui qui vacille ? Voici ce qui fait la différence";Santé;"Futura Sciences";;;;;https://www.futura-sciences.com/sante/actualites/stress-stress-anxiete-etes-vous-groupe-encaisse-celui-vacille-voici-ce-fait-difference-131490/#xtor%3DRSS-8;new
"2026-02-20 10:44";"TotalEnergies passe entre les mailles de la politique d’exclusion de la Caisse des dépôts";Économie;Novethic;;;;;https://www.novethic.fr/finance-durable/finance-verte/totalenergies-passe-entre-mailles-politique-exclusion-caisse-depots;new
"2026-02-20 09:00";"La preuve que détruire les forêts change le climat : une zone déboisée a gagné 4 °C !";Sciences;"Futura Sciences";;;;;https://www.futura-sciences.com/planete/actualites/environnement-preuve-detruire-forets-change-climat-zone-deboisee-gagne-4-c-131424/#xtor%3DRSS-8;failed
"2026-02-20 07:01";"Personne ne l’avait vu venir : ce virus « inoffensif » apparaît dans le cerveau des malades de Parkinson";Santé;"Futura Sciences";;;;;https://www.futura-sciences.com/sante/actualites/parkinson-personne-ne-avait-vu-venir-ce-virus-inoffensif-apparait-cerveau-malades-parkinson-w2t8-131228/#xtor%3DRSS-8;new
"2026-02-20 05:44";"À l’université, la course à l’IA générative fait émerger des objecteurs de conscience";Économie;Novethic;;;;;https://www.novethic.fr/economie-et-social/transformation-de-leconomie/enseignement-superieur-accelere-ia-generative-enseignants-positionnent-objecteurs-conscience;new
"2026-02-19 20:43";"Alerte sur les casques audio : une étude révèle que 81 modèles contiennent des substances chimiques et cancérigènes";Santé;"Futura Sciences";;;;;https://www.futura-sciences.com/sante/actualites/adolescent-alerte-casques-audio-etude-revele-81-modeles-contiennent-substances-chimiques-cancerigenes-131472/#xtor%3DRSS-8;new
"2026-02-19 18:23";"La tempête Pedro traverse la France avec vents, pluies et neiges abondantes : voici les régions les plus menacées ce soir";Sciences;"Futura Sciences";;;;;https://www.futura-sciences.com/planete/actualites/tempete-pedro-tempete-pedro-traverse-france-vents-pluies-neiges-abondantes-voici-regions-plus-menacees-ce-soir-131477/#xtor%3DRSS-8;failed
"2026-02-19 18:00";"Personne ne s’y attendait : l’IA pourrait révolutionner la météo tout en réduisant son impact climatique";Sciences;"Futura Sciences";;;;;https://www.futura-sciences.com/planete/actualites/meteorologie-personne-ne-y-attendait-ia-pourrait-revolutionner-meteo-tout-reduisant-son-impact-climatique-w2t8-131188/#xtor%3DRSS-8;failed
"2026-02-19 16:38";"""Non, TotalEnergies n’a pas le pouvoir de stopper le changement climatique"" : le devoir de vigilance face au risque climatique";Économie;Novethic;;;;;https://www.novethic.fr/environnement/climat/non-totalenergies-na-pas-le-pouvoir-de-stopper-le-changement-climatique-le-devoir-de-vigilance-face-au-risque-climatique;new
"2026-02-19 15:28";"Parkinson : bientôt plus une fatalité ? Ces avancées qui pourraient changer la trajectoire de la maladie";Santé;"Futura Sciences";;;;;https://www.futura-sciences.com/sante/actualites/parkinson-parkinson-bientot-plus-fatalite-ces-avancees-pourraient-changer-trajectoire-maladie-131416/#xtor%3DRSS-8;new
"2026-02-19 12:44";"40% des emplois dépendent de l'océan en France : un risque négligé par les entreprises";Économie;Novethic;;;;;https://www.novethic.fr/environnement/biodiversite/dependance-economique-oceans-risque-esg-neglige-entreprises;new
"2026-02-19 08:01";"60 Millions alerte : ces baguettes vendues partout posent problème";Santé;"Futura Sciences";;;;;https://www.futura-sciences.com/sante/actualites/alimentation-60-millions-alerte-ces-baguettes-vendues-partout-posent-probleme-w2t8-131224/#xtor%3DRSS-8;new
"2026-02-19 07:01";"Et si relancer l’énergie des neurones permettait de retarder Alzheimer et les démences ?";Santé;"Futura Sciences";;;;;https://www.futura-sciences.com/sante/actualites/cerveau-si-relancer-energie-neurones-permettait-retarder-alzheimer-demences-w2t8-131363/#xtor%3DRSS-8;new
"2026-02-19 05:44";"Décarbonation d’Arcelor à Dunkerque : coup de com' ou véritable avancée ?";Économie;Novethic;;;;;https://www.novethic.fr/environnement/climat/decarbonation-darcelor-a-dunkerque-coup-de-com-ou-veritable-avancee;new
"2026-02-18 17:15";"Alzheimer : une étude de grande ampleur confirme que la pollution de l’air a des effets directs sur le cerveau";Santé;"Futura Sciences";;;;;https://www.futura-sciences.com/sante/actualites/maladie-alzheimer-alzheimer-etude-grande-ampleur-confirme-pollution-air-effets-directs-cerveau-131418/#xtor%3DRSS-8;new
"2026-02-18 14:41";"La voiture de fonction, une manne pour les constructeurs, pas pour la transition écologique";Économie;Novethic;;;;;https://www.novethic.fr/economie-et-social/transformation-de-leconomie/voiture-fonction-manne-constructeurs-pas-transition-ecologique;new
"2026-02-18 14:03";"Combien d’années de vie on gagne quand on mange sainement ? Des chercheurs ont fait le calcul";Santé;"Futura Sciences";;;;;https://www.futura-sciences.com/sante/actualites/longevite-annees-vie-on-gagne-on-mange-sainement-chercheurs-ont-fait-calcul-131405/#xtor%3DRSS-8;new
"2026-02-18 10:59";"Catastrophes naturelles : le régime cat nat de nouveau sous pression face à l'amplification du changement climatique";Économie;Novethic;;;;;https://www.novethic.fr/finance-durable/tendances-de-marche/catastrophes-naturelles-assurance-reste-pression-changement-climatique;new
"2026-02-18 09:02";"Le bruit de la rue ne perturbe pas que votre sommeil : à 50 décibels, c'est votre biologie entière qu'il réécrit";Santé;"Futura Sciences";;;;;https://www.futura-sciences.com/sante/actualites/coeur-bruit-rue-ne-perturbe-pas-votre-sommeil-50-decibels-cest-votre-biologie-entiere-quil-reecrit-131353/#xtor%3DRSS-8;new
"2026-02-18 05:44";"Shein contraint de retirer ses allégations de neutralité carbone en Allemagne";Économie;Novethic;;;;;https://www.novethic.fr/environnement/climat/shein-neutralite-carbone-greenwashing-trompeur-allemagne;new
"2026-02-03 12:48";"Avec votre chien, il faut être juste et réaliste : vous ne demanderiez pas à un poisson rouge de grimper à un arbre…";Sciences;"Futura Sciences";;;;;https://www.futura-sciences.com/planete/actualites/chien-votre-chien-il-faut-etre-juste-realiste-vous-ne-demanderiez-pas-poisson-rouge-grimper-arbre-130599/#xtor%3DRSS-8;failed
"2026-01-14 10:43";"Bonnes résolutions 2026 : 4 leviers de sobriété énergétique";Environnement;"Natura Sciences";;;;;https://www.natura-sciences.com/s-adapter/bonnes-resolutions-energie-sobriete.html;new
"2025-10-31 16:15";"L’océan Austral, un puits de carbone à durée limitée ?";Environnement;"Natura Sciences";;;;;https://www.natura-sciences.com/comprendre/locean-austral-un-puits-de-carbone-a-duree-limitee.html;new
"2025-10-22 14:31";"Pfas :  l’Anses recommande une surveillance optimisée";Environnement;"Natura Sciences";;;;;https://www.natura-sciences.com/comprendre/pfas-lanses-recommande-une-surveillance-optimisee.html;new
"2025-10-13 07:34";"« État de nécessité » et scientifiques en rébellion : la justice tranchera en janvier";Environnement;"Natura Sciences";;;;;https://www.natura-sciences.com/agir/etat-de-necessite-scientifiques-en-rebellion-une-decision-attendue-en-janvier.html;new
"2025-09-25 10:16";"Quel fournisseur d’électricité adapté à vos besoins ?";Environnement;"Natura Sciences";;;;;https://www.natura-sciences.com/comprendre/quel-fournisseur-electricite-besoins.html;new
"2025-09-17 12:48";"Canicules : la responsabilité des majors fossiles établie";Environnement;"Natura Sciences";;;;;https://www.natura-sciences.com/comprendre/canicules-responsabilite-majors-fossiles-etablie.html;new
"2025-07-29 10:14";"Comment l’Europe s’apprête à financer la politique climaticide de Trump";Environnement;"Natura Sciences";;;;;https://www.natura-sciences.com/decider/europe-financer-climaticide-trump.html;new
"2025-07-25 15:42";"Climat : que peut changer l’arrêt « historique » de la Cour internationale de justice ?";Environnement;"Natura Sciences";;;;;https://www.natura-sciences.com/decider/arret-historique-cour-internationale-de-justice.html;new
"2025-07-18 14:05";"La Commission européenne étrille la politique écologique de la France";Environnement;"Natura Sciences";;;;;https://www.natura-sciences.com/decider/politique-ecologique-de-la-france-commission-europeenne.html;new
"2025-07-16 12:17";"Surtourisme et Airbnb : quand les villes françaises virent au rouge";Environnement;"Natura Sciences";;;;;https://www.natura-sciences.com/s-adapter/surtourisme-et-airbnb-quand-les-villes-francaises-virent-au-rouge.html;new
"2026-02-23 06:42";"Loi Duplomb : dans le fief du sénateur, les listes citoyennes se lancent dans la bataille des municipales";Environnement;Reporterre;;;;;https://reporterre.net/Loi-Duplomb-dans-le-fief-du-senateur-les-listes-citoyennes-se-lancent-dans-la-bataille-des-municipales;new
"2026-02-23 06:42";"Salon de l'agriculture : l'État festoie tout en sabrant les aides des agriculteurs";Environnement;Reporterre;;;;;https://reporterre.net/Salon-de-l-agriculture-l-Etat-festoie-tout-en-amputant-les-aides-des-agriculteurs;new
"2026-02-23 06:42";"« On n'a pas signé pour fabriquer des armes » : l'inquiétude de salariés Renault face à un projet de drones militaires";Environnement;Reporterre;;;;;https://reporterre.net/On-n-a-pas-signe-pour-fabriquer-des-armes-l-inquietude-de-salaries-Renault-face-a-un;new
"2026-02-23 06:42";"« Au jardin, ma minibassine ne me sauvera ni des crues ni des sécheresses »";Environnement;Reporterre;;;;;https://reporterre.net/Au-jardin-ma-minibassine-ne-me-sauvera-ni-des-crues-ni-des-secheresses;new
"2026-02-23 06:42";"Les fermes collectives, de « précieuses brèches » dans le modèle agro-industriel";Environnement;Reporterre;;;;;https://reporterre.net/Les-fermes-collectives-de-precieuses-breches-dans-le-modele-agro-industriel;new
"2026-02-23 06:42";"Au procès de TotalEnergies, des climatologues ruinent l'argumentaire du géant pétrolier";Environnement;Reporterre;;;;;https://reporterre.net/Au-proces-de-TotalEnergies-des-climatologues-ruinent-l-argumentaire-du-geant-petrolier;new
"2026-02-23 06:42";"« On ne veut plus de nous ici » : à Toulouse, les habitants du Mirail luttent pour sauver leurs logements";Environnement;Reporterre;;;;;https://reporterre.net/On-ne-veut-plus-de-nous-ici-a-Toulouse-les-habitants-du-Mirail-luttent-pour-sauver-leurs;new
"2026-02-23 06:42";"L'État français est l'un des principaux actionnaires de TotalEnergies grâce à l'argent des contribuables";Environnement;Reporterre;;;;;https://reporterre.net/L-Etat-francais-est-l-un-des-principaux-actionnaires-de-TotalEnergies-grace-a-l-argent-des-contribuables;new
"2026-02-23 06:42";"Mort de Quentin Deranque : les activistes écologistes lyonnais craignent la manifestation de l'extrême droite";Environnement;Reporterre;;;;;https://reporterre.net/Mort-d-un-militant-d-extreme-droite-a-Lyon-les-associations-de-gauche-et-ecologistes;new
"2026-02-23 06:42";"En Arctique, quand la pluie tombe, les rennes succombent";Environnement;Reporterre;;;;;https://reporterre.net/En-Arctique-quand-la-pluie-tombe-les-rennes-succombent;new
"2026-02-23 06:42";"Alice Coffin : « Les féministes sont mises sur la touche aux municipales »";Environnement;Reporterre;;;;;https://reporterre.net/Alice-Coffin-Les-feministes-sont-mises-sur-la-touche-aux-municipales;new
"2026-02-23 06:42";"« Notre écologie sera toujours antifasciste ! »";Environnement;Reporterre;;;;;https://reporterre.net/Notre-ecologie-sera-toujours-antifasciste;new
"2026-02-23 06:42";"« Total doit faire sa part » : premier jour du procès du géant pétrolier";Environnement;Reporterre;;;;;https://reporterre.net/Total-doit-faire-sa-part-premier-jour-du-proces-du-geant-petrolier;new
"2026-02-23 06:42";"La viande est jusqu'à 580 fois plus subventionnée que les protéines végétales en Europe";Environnement;Reporterre;;;;;https://reporterre.net/La-viande-est-jusqu-a-580-fois-plus-subventionnee-que-les-proteines-vegetales-en-Europe;new
"2026-02-23 06:42";"« Aide à mourir » : pourquoi certains, à gauche, s'opposent à la proposition de loi";Environnement;Reporterre;;;;;https://reporterre.net/Aide-a-mourir-pourquoi-certains-a-gauche-s-opposent-a-la-proposition-de-loi;new
"2026-02-23 06:42";"13 000 millionnaires français ne paient pas d'impôt sur le revenu";Environnement;Reporterre;;;;;https://reporterre.net/13-000-millionnaires-francais-ne-paient-aucun-impot-sur-le-revenu;new
"2026-02-23 06:42";"Exclusif – Sur l'A69, les fortes pluies font déborder des eaux non traitées";Environnement;Reporterre;;;;;https://reporterre.net/Exclusif-Sur-l-A69-les-fortes-pluies-font-deborder-des-eaux-non-traitees;new
"2026-02-23 06:42";"L'offensive plastique en partie déjouée au Sénat";Environnement;Reporterre;;;;;https://reporterre.net/L-offensive-plastique-en-partie-dejouee-au-Senat;new
"2026-02-23 06:42";"Gaspillage alimentaire : la fin des dates de péremption proposée pour les pâtes et le riz";Environnement;Reporterre;;;;;https://reporterre.net/Vers-la-suppression-des-dates-de-durabilite-sur-les-pates-et-le-riz;new
"2026-02-23 06:42";"Crues : « On a détruit tout ce qui permettait d'absorber la pluie »";Environnement;Reporterre;;;;;https://reporterre.net/Crues-On-a-detruit-tout-ce-qui-permettait-d-absorber-la-pluie;new
"2026-02-23 06:42";"Mayotte : les inondations sont prétexte aux expulsions";Environnement;Reporterre;;;;;https://reporterre.net/Les-inondations-a-Mayotte-l-alibi-de-l-Etat-pour-demolir-des-habitations-precaires;new
"2026-02-23 06:42";"Le casse-tête des véganes en zone rurale";Environnement;Reporterre;;;;;https://reporterre.net/Etre-vegane-en-zone-rurale-le-casse-tete-de-la-sortie-au-restaurant;new
"2026-02-23 06:42";"Cailles déplumées, sol grillagé... Carrefour épinglé par L214";Environnement;Reporterre;;;;;https://reporterre.net/Cailles-deplumees-sol-grillage-Carrefour-epingle-par-L214;new
"2026-02-23 06:42";"Zéro supermarché ? Elle ouvre une petite épicerie dans un quartier populaire";Environnement;Reporterre;;;;;https://reporterre.net/Zero-supermarche-Elle-ouvre-une-petite-epicerie-dans-un-quartier-populaire;new
"2026-02-23 06:42";"Tunisie, Maroc, Libye... Les villes du Maghreb submergées par les pluies";Environnement;Reporterre;;;;;https://reporterre.net/Tunisie-Maroc-Libye-Les-villes-du-Maghreb-submergees-par-les-pluies;new
"2026-02-23 06:42";"Non, l'intelligence artificielle n'est pas une alliée de la lutte climatique, confirme une étude";Environnement;Reporterre;;;;;https://reporterre.net/L-intelligence-artificielle-favorable-a-l-ecologie-est-un-canular-selon-une-etude;new
"2026-02-23 06:42";"Journalistes en garde à vue ou fichés... Au moins 91 atteintes à la liberté de la presse en France en 2024";Environnement;Reporterre;;;;;https://reporterre.net/Journalistes-en-garde-a-vue-ou-fiches-Au-moins-91-atteintes-a-la-liberte-de-la-presse-en-France-en-2024;new
"2026-02-23 06:42";"Roundup : Monsanto met 7 milliards de dollars sur la table pour échapper à la justice";Environnement;Reporterre;;;;;https://reporterre.net/Roundup-Monsanto-met-7-milliards-de-dollars-sur-la-table-pour-echapper-a-la-justice;new
"2026-02-23 06:42";"Les voitures de fonction profitent aux hommes riches, pas à la planète";Environnement;Reporterre;;;;;https://reporterre.net/Les-voitures-de-fonction-profitent-aux-hommes-riches-pas-a-la-planete;new
"2026-02-23 06:42";"Œufs de poules en cage : malgré leurs promesses, les supermarchés continuent d'en vendre";Environnement;Reporterre;;;;;https://reporterre.net/La-majorite-des-supermarches-vend-encore-des-oeufs-de-poules-elevees-en-cage;new
"2026-02-23 06:42";"Procès de TotalEnergies : « Les responsabilités des entreprises doivent être à la hauteur de leur capacité d'agir »";Environnement;Reporterre;;;;;https://reporterre.net/TotalEnergies-la-justice-ne-doit-pas-minimiser-le-devoir-de-vigilance-des-entreprises;new
"2026-02-23 06:42";"EDF condamnée à verser 250 000 euros à un lanceur d'alerte licencié";Environnement;Reporterre;;;;;https://reporterre.net/EDF-condamnee-a-verser-250-000-euros-a-un-lanceur-d-alerte-licencie;new
"2026-02-23 06:42";"Municipales 2026 : les villes d'extrême droite plus vulnérables au risque climatique";Environnement;Reporterre;;;;;https://reporterre.net/Municipales-ce-que-peuvent-les-communes-contre-les-effets-du-changement-climatique;new
"2026-02-23 06:42";"« L'Union européenne doit choisir : soit elle s'efface, soit elle s'affirme »";Environnement;Reporterre;;;;;https://reporterre.net/L-Union-europeenne-doit-choisir-soit-elle-s-efface-soit-elle-s-affirme;new
"2026-02-23 06:42";"Nouveaux OGM : les gros semenciers prêts à privatiser le vivant en Europe";Environnement;Reporterre;;;;;https://reporterre.net/Nouveaux-OGM-les-gros-semenciers-prets-a-privatiser-le-vivant-en-Europe;new
