date;title;category;source;primary_topic;seo_keywords;quality_score;seo_score;url;status
"2026-02-23 06:42";"Loups : les éleveurs bientôt autorisés à les abattre même si leurs troupeaux n'étaient pas protégés";Environnement;Reporterre;;;;;https://reporterre.net/Loups-les-eleveurs-bientot-autorises-a-les-abattre-meme-si-leurs-troupeaux-n-etaient-pas;new
"2026-02-23 06:42";"Du glyphosate épandu par avion sur les champs de coca en Colombie";Environnement;Reporterre;;;;;https://reporterre.net/La-Colombie-reprend-les-epandages-de-glyphosate-sur-les-champs-de-coca;new
"2026-02-23 06:42";"« Au secours, il faut partir ! » La crue fait céder des digues de la vallée de la Garonne";Environnement;Reporterre;;;;;https://reporterre.net/Au-secours-il-faut-partir-La-crue-fait-ceder-des-digues-de-la-vallee-de-la-Garonne;new
"2026-02-23 06:42";"Le retour du plastique à usage unique en débat au Sénat";Environnement;Reporterre;;;;;https://reporterre.net/Un-senateur-veut-faire-revenir-le-plastique-partout;new
"2026-02-23 06:42";"Les deux orques du Marineland d'Antibes pourraient être transférées vers l'Espagne";Environnement;Reporterre;;;;;https://reporterre.net/Marineland-les-orques-iront-en-Espagne-et-les-dauphins-a-Beauval;new
"2026-02-23 06:42";"Guyane : un « bateau végane » de Sea Shepherd s'allie aux pêcheurs locaux";Environnement;Reporterre;;;;;https://reporterre.net/Guyane-un-bateau-vegane-de-Sea-Shepherd-s-allie-aux-pecheurs-locaux;new
"2026-02-23 06:42";"Reblochons et chauves-souris : une zad savoyarde contre l'autoroute A412";Environnement;Reporterre;;;;;https://reporterre.net/Reblochons-et-chauves-souris-une-zad-savoyarde-contre-l-autoroute-A412;new
"2026-02-23 06:42";"Climat : le Crédit agricole condamné à 7,5 millions d'euros d'amende";Environnement;Reporterre;;;;;https://reporterre.net/Le-Credit-agricole-condamne-a-7-5-millions-d-euros-pour-manque-d-action-sur-le-risque;new
"2026-02-23 06:42";"Ils veulent libérer les quinze manchots papous enfermés dans un sous-sol de l'aquarium de Londres";Environnement;Reporterre;;;;;https://reporterre.net/A-Londres-ils-veulent-liberer-les-manchots-papous-de-l-aquarium;new
"2026-02-23 06:42";"Julien Bayou accusé de viol par une ex-compagne";Environnement;Reporterre;;;;;https://reporterre.net/Julien-Bayou-accuse-de-viol-par-une-ex-compagne;new
"2026-02-23 06:42";"Des chasseurs déploient une bâche en plastique de 1,7 km pour « piéger » les cerfs";Environnement;Reporterre;;;;;https://reporterre.net/Des-chasseurs-deploient-une-bache-en-plastique-de-1-7-km-pour-pieger-les-cerfs;new
"2026-02-23 06:42";"Police armée et vidéosurveillance : Bordeaux a-t-elle pris un virage sécuritaire ?";Environnement;Reporterre;;;;;https://reporterre.net/Policiers-armes-a-Bordeaux-le-maire-ecologiste-cede-a-la-pression;new
"2026-02-23 06:42";"300 journalistes licenciés : aux États-Unis, l'écologie sacrifiée par la presse pro-Trump";Environnement;Reporterre;;;;;https://reporterre.net/300-journalistes-licencies-l-ecologie-en-premiere-ligne-de-la-purge-aux-Etats-Unis;new
"2026-02-23 06:42";"« Il faut se libérer de l'obsession pour la figure d'autorité »";Environnement;Reporterre;;;;;https://reporterre.net/Il-faut-se-liberer-de-l-obsession-pour-la-figure-d-autorite;new
"2026-02-23 06:42";"En Martinique, le 14 février 1974, l'État tuait des ouvriers de la banane";Environnement;Reporterre;;;;;https://reporterre.net/En-Martinique-le-14-fevrier-1974-l-Etat-tuait-des-ouvriers-de-la-banane;new
"2026-02-23 06:42";"Ce refuge breton soigne les oiseaux épuisés par les tempêtes";Environnement;Reporterre;;;;;https://reporterre.net/Ce-refuge-breton-soigne-les-oiseaux-epuises-par-les-tempetes;new
"2026-02-23 06:42";"« Aimer sans posséder » : libérons-nous de l'amour capitaliste";Environnement;Reporterre;;;;;https://reporterre.net/Aimer-sans-posseder-liberons-nous-de-l-amour-capitaliste;new
"2026-02-23 06:42";"« Les industriels ont gagné la campagne de désinformation » : pourquoi le Zéro déchet n'a pas pris";Environnement;Reporterre;;;;;https://reporterre.net/Zero-dechet-pourquoi-ca-n-a-pas-pris;new
"2026-02-23 06:42";"« Amazon soutient la politique fasciste de l'ICE » : des écologistes s'invitent dans ses bureaux français";Environnement;Reporterre;;;;;https://reporterre.net/Amazon-soutient-la-politique-fasciste-de-l-ICE-des-ecologistes-s-invitent-dans-ses;new
"2026-02-23 06:42";"Plus de nucléaire, moins de renouvelables : la stratégie énergétique de la France signe la victoire des lobbies";Environnement;Reporterre;;;;;https://reporterre.net/Electricite-partout-sobriete-nulle-part-le-pari-vain-de-l-Etat;new
"2026-02-23 06:42";"Emmanuel Macron appelle à procréer mais oublie les causes de l'infertilité";Environnement;Reporterre;;;;;https://reporterre.net/Emmanuel-Macron-appelle-a-procreer-mais-oublie-les-causes-de-l-infertilite;new
"2026-02-23 06:42";"Démocratie participative : à Strasbourg, la maire a essayé sans vraiment convaincre";Environnement;Reporterre;;;;;https://reporterre.net/Democratie-participative-a-Strasbourg-la-maire-a-essaye-sans-vraiment-convaincre;new
"2026-02-23 06:42";"Aigle tué par des éoliennes : une nouvelle loi blanchit l'entreprise";Environnement;Reporterre;;;;;https://reporterre.net/Un-exploitant-de-parc-eolien-echappe-a-une-condamnation-grace-a-la-nouvelle-loi-agricole;new
"2026-02-23 06:42";"« Non au recycleur-pollueur » : ce projet d'usine qui fait tousser les riverains";Environnement;Reporterre;;;;;https://reporterre.net/Non-au-recycleur-pollueur-ce-projet-d-usine-qui-fait-tousser-les-riverains;new
"2026-02-23 06:42";"Trump abroge un texte fondateur encadrant les émissions de gaz à effet de serre";Environnement;Reporterre;;;;;https://reporterre.net/Trump-abroge-un-texte-fondateur-encadrant-les-emissions-de-gaz-a-effet-de-serre;new
